{"artifact_authenticity_mode":"MULTI_CHANNEL_VERIFIED","artifact_digest":{"artifact_size":2090678,"detached_signature_sha256":"f8bac9d15e0fc385aaaf7b93548424fc0cf08a37bc9da8149600a154189b71cb","detached_signature_status":"PRESENT_UNVERIFIED","detached_signature_url":"https://repo.maven.apache.org/maven2/io/projectreactor/reactor-core/3.7.9/reactor-core-3.7.9-sources.jar.asc","downloaded_bytes_sha256":"423e361d938ae0ec94ef56d2103dcaee7dfb041399570b7403b1e2adf37555bd","frozen_key_provenance_hash":null,"sidecar_sha256":"423e361d938ae0ec94ef56d2103dcaee7dfb041399570b7403b1e2adf37555bd","sidecar_verified":true,"signature_verification_receipt_hash":null,"signer_fingerprint":null},"audit_event":{"acquired_at":"2026-09-04T11:50:00Z","acquisition_run_id":"m336b.final-java.global-acquisition.v1","audit_hash":"d5165a549c7fad48f05d739ac14760706c3e2932983650d7ac93a2ba628e10dc","host":"windows","network_receipt_hashes":["141c6502618109f65e145435ee40dd970743b9a6995a1ded0f2435d9cc4b1e0a","a6ea870b8c046d14dac87f52b8146c545ec92bd55afcc280cba21d6483f9b967","da834469ddbe36abac6ff2ab8ba8a6e9743f305e997f93979dc859b5c31d76c7","e3664a0dc80fca99b028f4d8669955522fbc0642f1904108c9f4c101484da6eb"]},"conflicts":["SCM_LICENSE_CONFLICT"],"coordinate":{"canonical_repository_path":"io/projectreactor/reactor-core/3.7.9/reactor-core-3.7.9-sources.jar","classifier":"sources","extension":"jar","name":"reactor-core","namespace":"io.projectreactor","repository":"https://repo.maven.apache.org/maven2","version":"3.7.9"},"correspondence":{"ambiguous_count":0,"canonical_only_match_count":0,"correspondence_hash":"93007730bf981dcbed3a1905b644dfa2169b122b8a80ea8490bf57287636b19a","eligible_entry_count":441,"entries":[{"artifact_path":"reactor/adapter/JdkFlowAdapter.java","canonical_sha256":"111038ec75569feacc0341cdef6433e96c735ba21614cde1f7475537fa07f084","entry_hash":"a991c99934700e227ff2c0d05ef55e89da57863a5305fcbe769813a6380ed7d7","raw_sha256":"111038ec75569feacc0341cdef6433e96c735ba21614cde1f7475537fa07f084","repository_path":"reactor-core/src/main/java/reactor/adapter/JdkFlowAdapter.java","status":"RAW_EXACT_MATCH"},{"artifact_path":"reactor/adapter/package-info.java","canonical_sha256":"d6dee039342b342c68197537e1301a1da50d599ae2969e88cd04f6c1bcc7941c","entry_hash":"455ddacdff1b5a4ba3cf9701f15ca34848af054dfc6ae6e59e169cb489d169e2","raw_sha256":"089689c53c9b83413196ff7d87e7285d07dd6d722c1844040883c48ea0cccee2","repository_path":"reactor-core/src/main/java/reactor/adapter/package-info.java","status":"RAW_EXACT_MATCH"},{"artifact_path":"reactor/core/CorePublisher.java","canonical_sha256":"ba977a35f9bb8fb4175f966b7b1337a5c7264d0dca98662b1c3afdba4b801839","entry_hash":"f2d00b9656d74eae2e31a00d19b9118155147c5057a340993902eb8bd1a62aba","raw_sha256":"ba977a35f9bb8fb4175f966b7b1337a5c7264d0dca98662b1c3afdba4b801839","repository_path":"reactor-core/src/main/java/reactor/core/CorePublisher.java","status":"RAW_EXACT_MATCH"},{"artifact_path":"reactor/core/CoreSubscriber.java","canonical_sha256":"30673d385570060e3ef6c17c440d0cfe9fd3e7295f4fddbc5fb59ffe37f092f5","entry_hash":"3b18a78c998741673f93f64aa6d3b8696fac0e008e9a1abd3f390bb7caef836a","raw_sha256":"30673d385570060e3ef6c17c440d0cfe9fd3e7295f4fddbc5fb59ffe37f092f5","repository_path":"reactor-core/src/main/java/reactor/core/CoreSubscriber.java","status":"RAW_EXACT_MATCH"},{"artifact_path":"reactor/core/Disposable.java","canonical_sha256":"4a1da51007404879d3be0da8d3ac36904868e01bd08ae9ffdb9f810a3f07d95e","entry_hash":"fad2db598038345f0b5fcf67a0066d6d8c1091331eb482635920bb6c30f31aea","raw_sha256":"4a1da51007404879d3be0da8d3ac36904868e01bd08ae9ffdb9f810a3f07d95e","repository_path":"reactor-core/src/main/java/reactor/core/Disposable.java","status":"RAW_EXACT_MATCH"},{"artifact_path":"reactor/core/Disposables.java","canonical_sha256":"58bb3211ac38c04c6666f759685f8e96b8e047c71333524c7a70422ade7bf34b","entry_hash":"f043e5903116d60c597496c9ef2c490f1dd4d822efdcd1993ced3f36a109216e","raw_sha256":"58bb3211ac38c04c6666f759685f8e96b8e047c71333524c7a70422ade7bf34b","repository_path":"reactor-core/src/main/java/reactor/core/Disposables.java","status":"RAW_EXACT_MATCH"},{"artifact_path":"reactor/core/Exceptions.java","canonical_sha256":"2b4b79c6e3cba3ae84fcd4b8687f82402bf68c13e022f3097a3914987edc0dab","entry_hash":"17dd3fa7e4a348441febff329e20d30eaa9c24d56bc1ab135855761b1cc8829c","raw_sha256":"2b4b79c6e3cba3ae84fcd4b8687f82402bf68c13e022f3097a3914987edc0dab","repository_path":"reactor-core/src/main/java/reactor/core/Exceptions.java","status":"RAW_EXACT_MATCH"},{"artifact_path":"reactor/core/Fuseable.java","canonical_sha256":"f713dc5c6edd03e8693dda3bb797116541248292009485a4f52bbbd713a004b1","entry_hash":"7897afbdfbd7521418aa8efe54e1307a7709bd0baf13d4473611f8457a724a8f","raw_sha256":"f03fe49950dadd73560db62067f85b155638bf4f0196dcad9226e3d07d00a3b0","repository_path":"reactor-core/src/main/java/reactor/core/Fuseable.java","status":"RAW_EXACT_MATCH"},{"artifact_path":"reactor/core/Scannable.java","canonical_sha256":"31cc8b63e0c185574c6bd69dfe9e67ea27c5641ff96b9b7bd619d8a7d01172ab","entry_hash":"12e34d49625a792f97b17483c5f972672b7c837ca0d2c8622dc98d882aa2106b","raw_sha256":"31cc8b63e0c185574c6bd69dfe9e67ea27c5641ff96b9b7bd619d8a7d01172ab","repository_path":"reactor-core/src/main/java/reactor/core/Scannable.java","status":"RAW_EXACT_MATCH"},{"artifact_path":"reactor/core/observability/DefaultSignalListener.java","canonical_sha256":"e5d6dc9545bd56c617bee9536bed255de2a5035050fe413e747c0690836cb9ac","entry_hash":"efc1f2e251c1f75e5c15056b66d5c3b39b6f64ba662b79338b426319505490e3","raw_sha256":"e5d6dc9545bd56c617bee9536bed255de2a5035050fe413e747c0690836cb9ac","repository_path":"reactor-core/src/main/java/reactor/core/observability/DefaultSignalListener.java","status":"RAW_EXACT_MATCH"},{"artifact_path":"reactor/core/observability/SignalListener.java","canonical_sha256":"d9dd02d4fcb7692f508878421a95bf78fc26950240ef0dadded9da6cf3da5855","entry_hash":"bf55238cc90c0a21a8f40a4ae24fb351fb2761d33bfdbf32d8c5696ab401e2d8","raw_sha256":"d9dd02d4fcb7692f508878421a95bf78fc26950240ef0dadded9da6cf3da5855","repository_path":"reactor-core/src/main/java/reactor/core/observability/SignalListener.java","status":"RAW_EXACT_MATCH"},{"artifact_path":"reactor/core/observability/SignalListenerFactory.java","canonical_sha256":"0b7188a1d60d89b6f4a1616326283620825ef8815cbd1a9f81cfa45df026fc2b","entry_hash":"ae47e8a978e5a8a8646e69c750e5a08a1dc5dd72af337388b4e8fa0d7bcc5a55","raw_sha256":"0b7188a1d60d89b6f4a1616326283620825ef8815cbd1a9f81cfa45df026fc2b","repository_path":"reactor-core/src/main/java/reactor/core/observability/SignalListenerFactory.java","status":"RAW_EXACT_MATCH"},{"artifact_path":"reactor/core/package-info.java","canonical_sha256":"fcbfdd3d83f8192ee53828dfe44797f0bc4ac29137236b6b5f491fa83c839145","entry_hash":"dc3b204f63926e325f602d3431a8d3989e206274933f81da96f446a703976ef4","raw_sha256":"9f7d14ec9568c4946567be5cad7883a0e12550600b2c407218d759a440b4f018","repository_path":"reactor-core/src/main/java/reactor/core/package-info.java","status":"RAW_EXACT_MATCH"},{"artifact_path":"reactor/core/publisher/BaseSubscriber.java","canonical_sha256":"fcd60f1245dc1b99727b212e11f7fc10515905df1cbffa977ca62fca45922512","entry_hash":"bb42089651d79fde85b3b0f9977eb51c74b1fb0dbbfc198ae02ee7de29625a85","raw_sha256":"fcd60f1245dc1b99727b212e11f7fc10515905df1cbffa977ca62fca45922512","repository_path":"reactor-core/src/main/java/reactor/core/publisher/BaseSubscriber.java","status":"RAW_EXACT_MATCH"},{"artifact_path":"reactor/core/publisher/BlockingFirstSubscriber.java","canonical_sha256":"6642fbc2de13e02c2923409aaa4242f6a43a68c1f0789e52828c0dae3327fafe","entry_hash":"535258d144f0a84820241720b766c079f2d44c5242c68f5b9b09ab5de2c0cff1","raw_sha256":"6642fbc2de13e02c2923409aaa4242f6a43a68c1f0789e52828c0dae3327fafe","repository_path":"reactor-core/src/main/java/reactor/core/publisher/BlockingFirstSubscriber.java","status":"RAW_EXACT_MATCH"},{"artifact_path":"reactor/core/publisher/BlockingIterable.java","canonical_sha256":"b4700c5af970ed6408e45f1e40c7ea0ea714dbb34230b4285dbb53a3cdbaab6d","entry_hash":"08873632021853ef6569b5f2a1e23da238f96324c82ea962e02469f0d2e98a77","raw_sha256":"b4700c5af970ed6408e45f1e40c7ea0ea714dbb34230b4285dbb53a3cdbaab6d","repository_path":"reactor-core/src/main/java/reactor/core/publisher/BlockingIterable.java","status":"RAW_EXACT_MATCH"},{"artifact_path":"reactor/core/publisher/BlockingLastSubscriber.java","canonical_sha256":"cfd592524f8eed6542c6be815d398b3630ee980e82d531d7b5bd1e0b54ef60b1","entry_hash":"a856a0ee6d803c64f3f44ee13996dc55c3921474d508b369363a3444aadbaefe","raw_sha256":"cfd592524f8eed6542c6be815d398b3630ee980e82d531d7b5bd1e0b54ef60b1","repository_path":"reactor-core/src/main/java/reactor/core/publisher/BlockingLastSubscriber.java","status":"RAW_EXACT_MATCH"},{"artifact_path":"reactor/core/publisher/BlockingMonoSubscriber.java","canonical_sha256":"901081f98d0aaee639a81ec0ac93db51eb20afff512a2ff73f0227c4c0916293","entry_hash":"8a836f30613c223cee0e58d555eeef0f51d2583d7a45d9641980ac614526396b","raw_sha256":"901081f98d0aaee639a81ec0ac93db51eb20afff512a2ff73f0227c4c0916293","repository_path":"reactor-core/src/main/java/reactor/core/publisher/BlockingMonoSubscriber.java","status":"RAW_EXACT_MATCH"},{"artifact_path":"reactor/core/publisher/BlockingOptionalMonoSubscriber.java","canonical_sha256":"776d04a8a8cba60ed968affba6fc4252984cb5b11e8702487ad4534717ca0712","entry_hash":"e7abc422cc06196d549f3a3ad5d1a38feccd74e8435de8285ecb3d863d484849","raw_sha256":"776d04a8a8cba60ed968affba6fc4252984cb5b11e8702487ad4534717ca0712","repository_path":"reactor-core/src/main/java/reactor/core/publisher/BlockingOptionalMonoSubscriber.java","status":"RAW_EXACT_MATCH"},{"artifact_path":"reactor/core/publisher/BlockingSingleSubscriber.java","canonical_sha256":"cee5e1a4f72c5f5e98b0cfc8225b742a04c1cd7e7e95fb389a12275fa90704d6","entry_hash":"ac9b3daa4c8c42dd925a6f48dec8aedae44e5b3c525ef230c4124e431ccdef5d","raw_sha256":"cee5e1a4f72c5f5e98b0cfc8225b742a04c1cd7e7e95fb389a12275fa